{
  "id": "center-split-transition",
  "version": "1.0.0",
  "tier": "free",
  "name": "Center Split Transition",
  "category": "Transitions",
  "description": "A central counter and line open into two outward-moving panels.",
  "keywords": [
    "page",
    "transition",
    "center-split-transition",
    "center-split"
  ],
  "settings": [
    {
      "key": "autoplay",
      "kind": "boolean",
      "label": "Play on entry",
      "default": true,
      "group": "Playback",
      "description": "Replay the entrance on mount and settings changes. Disable for manually triggered navigation."
    },
    {
      "key": "heading",
      "kind": "text",
      "label": "Heading",
      "default": "A considered space.\nA quieter arrival.",
      "group": "Content",
      "maxLength": 100,
      "description": "Demo headline. Line breaks are preserved; custom React children own their own copy."
    },
    {
      "key": "caption",
      "kind": "text",
      "label": "Caption",
      "default": "Light, texture and room to breathe.\nA thoughtful beginning, every time.",
      "group": "Content",
      "maxLength": 180,
      "description": "Demo supporting copy. Custom React children own their own copy."
    },
    {
      "key": "background",
      "kind": "color",
      "label": "Canvas",
      "default": "#1b211c",
      "group": "Palette",
      "description": "Receiving canvas behind the demo image. Visible while the image loads or wherever content leaves the canvas uncovered."
    },
    {
      "key": "foreground",
      "kind": "color",
      "label": "Text",
      "default": "#f7f5ee",
      "group": "Palette",
      "description": "Base color for the demo headline, supporting copy and credit. The replay action and overlay labels use their own colors."
    },
    {
      "key": "overlayColor",
      "kind": "color",
      "label": "Cover",
      "default": "#0a0a0a",
      "group": "Palette",
      "description": "Opaque cover and reveal layer color."
    },
    {
      "key": "minHeight",
      "kind": "number",
      "label": "Minimum height",
      "default": 520,
      "group": "Geometry",
      "min": 200,
      "max": 1000,
      "step": 10,
      "description": "Minimum receiving area height in pixels. The layout follows its container width."
    },
    {
      "key": "duration",
      "kind": "number",
      "label": "Panel opening",
      "default": 700,
      "group": "Motion",
      "min": 20,
      "max": 5000,
      "step": 10,
      "description": "Time in milliseconds for the top and bottom panels to open after the line sequence and Covered hold."
    },
    {
      "key": "coverDuration",
      "kind": "number",
      "label": "Navigation cover",
      "default": 500,
      "group": "Motion",
      "min": 100,
      "max": 2000,
      "step": 10,
      "description": "Outgoing cover duration in milliseconds. Applies to Next scene, cover() and navigate(), not Replay reveal."
    },
    {
      "key": "hold",
      "kind": "number",
      "label": "Covered hold",
      "default": 0,
      "group": "Motion",
      "min": 0,
      "max": 2000,
      "step": 10,
      "description": "Covered pause in milliseconds after the line sequence, before the panels open. Entry delay applies before the line sequence."
    },
    {
      "key": "leadIn",
      "kind": "number",
      "label": "Entry delay",
      "default": 0,
      "group": "Motion",
      "min": 0,
      "max": 3000,
      "step": 10,
      "description": "Initial reveal delay in milliseconds. Navigation cover uses its separate duration."
    },
    {
      "key": "travel",
      "kind": "number",
      "label": "Rise distance",
      "default": 8,
      "group": "Motion",
      "min": 0,
      "max": 48,
      "step": 1,
      "description": "Content rise in pixels during opening. Custom content uses a direct data-pt-content child."
    },
    {
      "key": "easing",
      "kind": "select",
      "label": "Motion curve",
      "default": "split",
      "group": "Motion",
      "options": [
        {
          "label": "Expressive",
          "value": "expressive"
        },
        {
          "label": "Smooth",
          "value": "smooth"
        },
        {
          "label": "Linear",
          "value": "linear"
        },
        {
          "label": "Symmetric ease",
          "value": "split"
        }
      ],
      "description": "Curve for the two panels opening outward and the incoming content rise. Line drawing, fill and fading keep their own curves."
    },
    {
      "key": "lineDuration",
      "kind": "number",
      "label": "Counter and line sequence",
      "default": 1031,
      "group": "Motion",
      "min": 100,
      "max": 1500,
      "step": 10,
      "description": "Milliseconds scaling the line draw, fill and stretch together. The counter is decorative, not loading progress."
    },
    {
      "key": "counterColor",
      "kind": "color",
      "label": "Counter and fill",
      "default": "#dc9058",
      "group": "Palette",
      "description": "Shared color of the counter and progress fill."
    }
  ],
  "targets": [
    "react",
    "html",
    "vanilla"
  ],
  "dependencies": {},
  "assets": [
    {
      "path": "assets/reveal-hero.webp",
      "rights": {
        "kind": "original",
        "attribution": "Arclen original generated editorial artwork",
        "license": "Included with the Arclen component and generated website."
      },
      "gallery": true
    },
    {
      "path": "assets/geist-latin.woff2",
      "rights": {
        "kind": "licensed",
        "license": "SIL Open Font License 1.1",
        "attribution": "Geist authors; see assets/OFL-Geist.txt"
      }
    },
    {
      "path": "assets/OFL-Geist.txt",
      "rights": {
        "kind": "licensed",
        "license": "SIL Open Font License 1.1",
        "attribution": "Geist authors; see assets/OFL-Geist.txt"
      }
    },
    {
      "path": "assets/arclen-wordmark.svg",
      "rights": {
        "kind": "licensed",
        "attribution": "Arclen wordmark, used at the brand owner’s request for this demo.",
        "license": "Arclen brand asset. Demo use only; trademark rights reserved."
      }
    },
    {
      "path": "assets/GeistMono-Regular.woff2",
      "rights": {
        "kind": "licensed",
        "license": "OFL-1.1",
        "attribution": "Copyright 2024 The Geist Project Authors; https://github.com/vercel/geist-font"
      },
      "contentType": "font/woff2"
    },
    {
      "path": "assets/OFL-GeistMono.txt",
      "rights": {
        "kind": "licensed",
        "license": "OFL-1.1",
        "attribution": "Copyright 2024 The Geist Project Authors; https://github.com/vercel/geist-font"
      },
      "contentType": "text/plain"
    },
    {
      "path": "assets/hero-card.webp",
      "rights": {
        "kind": "original",
        "attribution": "Arclen original generated editorial artwork",
        "license": "Included with the Arclen component and generated website."
      },
      "gallery": false
    },
    {
      "path": "assets/hero-mobile.webp",
      "rights": {
        "kind": "original",
        "attribution": "Arclen original generated editorial artwork",
        "license": "Included with the Arclen component and generated website."
      },
      "gallery": false
    }
  ],
  "poster": "poster.webp",
  "motion": {
    "reducedMotion": "Reveal usable content immediately. Active motion settles when the preference changes.",
    "pauseOffscreen": true
  },
  "previews": [
    {
      "name": "Original pace",
      "settings": {
        "duration": 700,
        "coverDuration": 500,
        "hold": 0,
        "leadIn": 0,
        "easing": "split",
        "lineDuration": 1031
      }
    },
    {
      "name": "Swift entrance",
      "settings": {
        "duration": 504,
        "coverDuration": 360,
        "hold": 0,
        "leadIn": 0,
        "easing": "split",
        "lineDuration": 742
      }
    },
    {
      "name": "Slow reveal",
      "settings": {
        "duration": 875,
        "coverDuration": 625,
        "hold": 0,
        "leadIn": 0,
        "easing": "split",
        "lineDuration": 1289
      }
    }
  ]
}
